{
  "schema_version": 1,
  "api_version": 1,
  "id": "example.notes",
  "name": "Notes",
  "version": "1.0.0",
  "description": "A bounded notes page.",
  "author": "Example",
  "compatibility": {
    "chronlyt": ">=0.2.1, <0.3.0"
  },
  "component": {
    "path": "assets/CON.wasm",
    "sha256": "aaaaaaaaaaaaaaaaaaaaaaaaaaaaaaaaaaaaaaaaaaaaaaaaaaaaaaaaaaaaaaaa"
  },
  "permissions": [
    "storage.read",
    "storage.write"
  ],
  "pages": [
    {
      "id": "notes",
      "title": "Notes",
      "description": "Private local notes"
    }
  ],
  "assets": []
}
